objectid,filename,title,creator,date,description,subject,location,latitude,longitude,identifier,type,format,culture,materials,measurements,credit,published,web_page,altnum
396,jsma2014_39_15.jpg,Bowl,"Dresser, Christopher; Hukin & Heath",ca. 1890,"Considered the first industrial designer, Christopher Dresser created designs for a wide range of manufacturers in Great Britain, France, and the United States. Dresser was a visionary who realized the potential of new technologies to revolutionize the consumer market for home goods. Unlike the Arts & Crafts movement, which championed a return to handmade craft, Dresser embraced the Industrial Revolution. By using more advanced mechanical techniques, Dresser had more freedom to construct a wide variety of creative and complex forms in large quantities. Many of his designs still look fresh and modern to today’s audiences. His innovative designs, not only in metalwork but also in textiles, wallpaper, carpets, ceramics, and furniture, made Dresser an extremely influential figure in the design world. His books on industrial design and Japanese art were widely read in both Britain and the United States.","Dresser, Christopher; Hukin & Heath;British;Silverplate;London, England","London, England",51.512348,-0.131508,JSMA2014:39.15,Image;StillImage,image/jpeg,British,Silverplate,overall: H. 2 x W. 9 1/2 in; H. 5.08 x W. 24.13 cm,"Margo Grant Walsh Twentieth Century Silver and Metalwork Collection, gift of Margo Grant Walsh",Y,https://jsmacollection.uoregon.edu/mwebcgi/mweb?request=record;id=111122;type=101,N0455
323,jsma2014_39_50.jpg,Cream pitcher,William Hutton & Sons,1907,Cream pitcher with hammered interior finish and beak spout with decorative beading.,"William Hutton & Sons;British;Sterling silver;London, England","London, England",51.512348,-0.131508,JSMA2014:39.50,Image;StillImage,image/jpeg,British,Sterling silver,H. 4-1/8 x W. 4-7/16 x Diam. 2-1/2 inches,"Margo Grant Walsh Twentieth Century Silver and Metalwork Collection, gift of Margo Grant Walsh",Y,https://jsmacollection.uoregon.edu/mwebcgi/mweb?request=record;id=111157;type=101,P0199
324,jsma2014_39_51.jpg,Salt and pepper casters,"Bonner, Albert Edward",1906-1908,Small salt and pepper casters with chased lines and collet-set turquoise cabochons.,"Bonner, Albert Edward;British;Sterling silver with enamel cabochons;London, England","London, England",51.512348,-0.131508,"JSMA2014:39.51a,b",Image;StillImage,image/jpeg,British,Sterling silver with enamel cabochons,each: H: 2-1/4 x Diam: 1-5/8 inches,"Margo Grant Walsh Twentieth Century Silver and Metalwork Collection, gift of Margo Grant Walsh",Y,https://jsmacollection.uoregon.edu/mwebcgi/mweb?request=record;id=111158;type=101,P0215
325,jsma2014_39_52.jpg,Stacking beakers,Wakely & Wheeler,1912,Set of flared stacking beakers with hammered finish. Each beaker made precisely 1/16 of an inch larger in size than the previous beaker in order to achieve this seamless nesting.,"Wakely & Wheeler;British;Sterling silver;London, England","London, England",51.512348,-0.131508,JSMA2014:39.52a-d,Image;StillImage,image/jpeg,British,Sterling silver,A: 3-1/8 inches; B: 3-1/16 inches; C: 3 inches; D: 2-15/16 inches,"Margo Grant Walsh Twentieth Century Silver and Metalwork Collection, gift of Margo Grant Walsh",Y,https://jsmacollection.uoregon.edu/mwebcgi/mweb?request=record;id=111159;type=101,T0146
326,jsma2016_12_186.jpg,Vase,"Spencer, Edward",ca. 1915,,"Spencer, Edward;British;Copper and silver;London, England","London, England",51.512348,-0.131508,JSMA2016:12.186,Image;StillImage,image/jpeg,British,Copper and silver,H. 7 x Diam. 3-3/8 inches,"Margo Grant Walsh Twentieth Century Silver and Metalwork Collection, gift of Margo Grant Walsh",Y,https://jsmacollection.uoregon.edu/mwebcgi/mweb?request=record;id=122497;type=101,N0621
482,jsma2016_12_57.jpg,Candlesticks,"Knox, Archibald; Liberty & Company",ca. 1905,"These pewter candlesticks were produced as part of Liberty & Company's Tudric range of inexpensive Arts and Crafts items, many of which were designed by Archibald Knox.","Knox, Archibald; Liberty & Company;British;Pewter;London, England","London, England",51.512348,-0.131508,"JSMA2016:12.57a,b",Image;StillImage,image/jpeg,British,Pewter,each: 3-3/4 x 3-3/8 inches,"Margo Grant Walsh Twentieth Century Silver and Metalwork Collection, gift of Margo Grant Walsh",Y,https://jsmacollection.uoregon.edu/mwebcgi/mweb?request=record;id=119716;type=101,N0822
91,jsma2016_12_80.jpg,Spoon,Liberty & Company,ca. 1910,Spoon with heart shaped bowl and stem with decorative pierced hinge and looped terminal.,"Liberty & Company;British;Sterling silver;London, England","London, England",51.512348,-0.131508,JSMA2016:12.80,Image;StillImage,image/jpeg,British,Sterling silver,7-3/8 inches,"Margo Grant Walsh Twentieth Century Silver and Metalwork Collection, gift of Margo Grant Walsh",Y,https://jsmacollection.uoregon.edu/mwebcgi/mweb?request=record;id=119744;type=101,N1530
473,jsma2016_12_87.jpg,Mantel Clock,William Tonks & Sons,ca. 1900-10,"This mantel clock, which was also offered in copper, is made in the same style as the objects produced by Liberty & Co., one of the most well-known British manufacturers of sterling silver. Liberty & Co. is credited with popularizing the Arts and Crafts style, which favored naturalistic motifs and neo-Celtic decoration, both seen here. The similarity in style is not surprising, as Liberty’s influence was widespread. In addition, William Tonks and Sons was one of the many suppliers of metalwork for Liberty’s store. While Tonks and Sons mainly manufactured domestic objects for Liberty, they produced a wide variety of items for other companies. The company manufactured campaign metalware, architectural hardware, ecclesiastical metalwork, and art metal ware. Hailing from Birmingham, the firm moved to London in 1860, where it gained success, winning medals at exhibitions in Paris and London.","William Tonks & Sons;British;Silverplate and glass with enamel cabochons;London, England","London, England",51.512348,-0.131508,JSMA2016:12.87,Image;StillImage,image/jpeg,British,Silverplate and glass with enamel cabochons,H. 11 x W. 6-3/8 x D. 8 inches,"Margo Grant Walsh Twentieth Century Silver and Metalwork Collection, gift of Margo Grant Walsh",Y,https://jsmacollection.uoregon.edu/mwebcgi/mweb?request=record;id=119751;type=101,P0109/M0007
456,jsma2016_12_89.jpg,Box,"Baker, Oliver; Liberty & Company",ca. 1910-20,"Arthur Lasenby Liberty’s firm Liberty and Co. hired artists like Archibald Knox and Oliver Baker to attend to the burgeoning demand for British Arts and Crafts metalware at the turn of the century. Rather than strictly adhering to the guild model of handicraft, Liberty and Co. combined machine production with hand-finishing detailing. This pewter box, designed by Oliver Baker for Liberty and Co.’s Tudric line of pewterware, is ornamented with twisted copper.","Baker, Oliver; Liberty & Company;British;Pewter, copper;London, England","London, England",51.512348,-0.131508,JSMA2016:12.89,Image;StillImage,image/jpeg,British,"Pewter, copper",H. 4-1/2 x W. 3 x D. 3 inches,"Margo Grant Walsh Twentieth Century Silver and Metalwork Collection, gift of Margo Grant Walsh",Y,https://jsmacollection.uoregon.edu/mwebcgi/mweb?request=record;id=119753;type=101,P0134/S0085
457,jsma2016_12_92.jpg,Container with enameled lid,Liberty & Company,1902,,"Liberty & Company;British;Sterling silver, enamel;London, England","London, England",51.512348,-0.131508,JSMA2016:12.92,Image;StillImage,image/jpeg,British,"Sterling silver, enamel",H. 3 x Diam. 4-1/2 inches,"Margo Grant Walsh Twentieth Century Silver and Metalwork Collection, gift of Margo Grant Walsh",Y,https://jsmacollection.uoregon.edu/mwebcgi/mweb?request=record;id=119756;type=101,S0003
458,jsma2016_12_93.jpg,Container and lid with enameled cabochons,Liberty & Company,ca. 1910-20,,"Liberty & Company;British;Pewter with turquoise enamel cabochons;London, England","London, England",51.512348,-0.131508,JSMA2016:12.93,Image;StillImage,image/jpeg,British,Pewter with turquoise enamel cabochons,H. 4 x Diam. 3-3/8 inches,"Margo Grant Walsh Twentieth Century Silver and Metalwork Collection, gift of Margo Grant Walsh",Y,https://jsmacollection.uoregon.edu/mwebcgi/mweb?request=record;id=119757;type=101,S0097
147,jsma2017_2_18.jpg,Belt buckle,Liberty & Company,20th century,"Buckle in sheild form with hammered finish, chasing, and scrolling strapwork.","Liberty & Company;British;Silver;London, England","London, England",51.512348,-0.131508,JSMA2017:2.18,Image;StillImage,image/jpeg,British,Silver,W. 4 x D. 3 inches,"Margo Grant Walsh Twentieth Century Silver and Metalwork Collection, gift of Margo Grant Walsh",Y,https://jsmacollection.uoregon.edu/mwebcgi/mweb?request=record;id=126274;type=101,N0353
303,jsma2017_2_27.jpg,Candlesticks,William Hutton & Sons,ca. 19th century,,"William Hutton & Sons;British;Sterling silver with garnet cabochons;London, England","London, England",51.512348,-0.131508,JSMA2017:2.27a-b,Image;StillImage,image/jpeg,British,Sterling silver with garnet cabochons,each: H. 3-1/4 x W. 3-1/4 x D. 4-1/4 inches,"Margo Grant Walsh Twentieth Century Silver and Metalwork Collection, gift of Margo Grant Walsh",Y,https://jsmacollection.uoregon.edu/mwebcgi/mweb?request=record;id=126384;type=101,NO MGW NUMBER
174,jsma2017_2_47.jpg,"Spoons, set of six [boxed]","Stone, Robert Edgar",1935,,"Stone, Robert Edgar;British;Silver;London, England","London, England",51.512348,-0.131508,JSMA2017:2.47a-f,Image;StillImage,image/jpeg,British,Silver,each: 4-1/8 inches,"Margo Grant Walsh Twentieth Century Silver and Metalwork Collection, gift of Margo Grant Walsh",Y,https://jsmacollection.uoregon.edu/mwebcgi/mweb?request=record;id=126302;type=101,N1250
336,jsma2019_11_11.jpg,Goblets,"Miller, Hector",1979,"Pair of goblets with oak leaf embellishment, horse figurines in the stems of cups. Bottom reads ""Number 398 By order of the new forest ninth centenery trust this goblet has been produced to mark th 900th anniversary of the forest in 1979"" AURUM  Parcel gilt indicates partially gilded","Miller, Hector;British;Sterling silver and silver gilt;London, England","London, England",51.512348,-0.131508,"JSMA2019:11.11a,b",Image;StillImage,image/jpeg,British,Sterling silver and silver gilt,each: 6-1/2 in x 3 inches,"Margo Grant Walsh Twentieth Century Silver and Metalwork Collection, gift of Margo Grant Walsh",N,https://jsmacollection.uoregon.edu/mwebcgi/mweb?request=record;id=136057;type=101,N0163
351,jsma2019_11_112.jpg,Perfume flask,Ottewill Silversmiths,1995,,"Ottewill Silversmiths;British;Sterling silver with aventurine cabochon;London, England","London, England",51.512348,-0.131508,JSMA2019:11.112,Image;StillImage,image/jpeg,British,Sterling silver with aventurine cabochon,H. 3-1/4 x Diam. 2-1/4 inches,"Margo Grant Walsh Twentieth Century Silver and Metalwork Collection, gift of Margo Grant Walsh",N,https://jsmacollection.uoregon.edu/mwebcgi/mweb?request=record;id=136170;type=101,P0123/S0024
93,jsma2019_11_138.jpg,Spoons (2 pieces),"Storr, Paul",1816,,"Storr, Paul;British;Sterling silver;London, England","London, England",51.512348,-0.131508,"JSMA2019:11.138a,b",Image;StillImage,image/jpeg,British,Sterling silver,each: 9 inches,"Margo Grant Walsh Twentieth Century Silver and Metalwork Collection, gift of Margo Grant Walsh",N,https://jsmacollection.uoregon.edu/mwebcgi/mweb?request=record;id=138369;type=101,N1057
182,jsma2019_11_19.jpg,Caddy spoon,"Stone, Robert Edgar",1934,"Robert Edgar Stone designed this caddy spoon, used to measure tea leaves in honor of King George V's silver jubilee (the twenty-fifth anniversary of his accession to the British throne) in 1934.","Stone, Robert Edgar;British;Sterling silver;London, England","London, England",51.512348,-0.131508,JSMA2019:11.19,Image;StillImage,image/jpeg,British,Sterling silver,3 inches,"Margo Grant Walsh Twentieth Century Silver and Metalwork Collection, gift of Margo Grant Walsh",Y,https://jsmacollection.uoregon.edu/mwebcgi/mweb?request=record;id=136065;type=101,N0250
580,jsma2019_11_43.jpg,Napkin rings (pair),"Felton, Katey",2007,,"Felton, Katey;British;.950 fine silver;London, England","London, England",51.512348,-0.131508,JSMA2019:11.43,Image;StillImage,image/jpeg,British,.950 fine silver,each: H. 1-7/8 x W. 1-5/8 x D. 1-5/8 inches,"Margo Grant Walsh Twentieth Century Silver and Metalwork Collection, gift of Margo Grant Walsh",N,https://jsmacollection.uoregon.edu/mwebcgi/mweb?request=record;id=136094;type=101,N0790
357,jsma2019_11_48.jpg,Bowl,"Knox, Archibald; Liberty & Company",ca. 1910,,"Knox, Archibald; Liberty & Company;British;Pewter;London, England","London, England",51.512348,-0.131508,JSMA2019:11.48,Image;StillImage,image/jpeg,British,Pewter,H. 6-1/2 x Diam. 11 inches,"Margo Grant Walsh Twentieth Century Silver and Metalwork Collection, gift of Margo Grant Walsh",N,https://jsmacollection.uoregon.edu/mwebcgi/mweb?request=record;id=136100;type=101,N0914
564,jsma2019_11_58.jpg,Tray,"Pearson, John",late 19th-early 20th century,Arts and crafts hammered copper tray with twisted handles.,"Pearson, John;British;Copper;London, England","London, England",51.512348,-0.131508,JSMA2019:11.58,Image;StillImage,image/jpeg,British,Copper,H. 2-1/4 x W. 25 x D. 15 inches,"Margo Grant Walsh Twentieth Century Silver and Metalwork Collection, gift of Margo Grant Walsh",N,https://jsmacollection.uoregon.edu/mwebcgi/mweb?request=record;id=136111;type=101,N0999
347,jsma2019_11_67.jpg,Pill box,Ottewill Silversmiths,1995,,"Ottewill Silversmiths;British;Sterling silver wtih aventurine cabochon;London, England","London, England",51.512348,-0.131508,JSMA2019:11.67,Image;StillImage,image/jpeg,British,Sterling silver wtih aventurine cabochon,H. 1-1/2 x W. 1-1/4 x D. 1-1/4 inches,"Margo Grant Walsh Twentieth Century Silver and Metalwork Collection, gift of Margo Grant Walsh",N,https://jsmacollection.uoregon.edu/mwebcgi/mweb?request=record;id=136121;type=101,N1107
348,jsma2019_11_77.jpg,Table garniture (15 pieces),C.J. Vander,1971,,"C.J. Vander;British;Sterling silver, silver gilt, glass;London, England","London, England",51.512348,-0.131508,JSMA2019:11.77a-o,Image;StillImage,image/jpeg,British,"Sterling silver, silver gilt, glass","A-D (casters): H. 3-13/16 x Diam. 1-1/4 x 1-1/4 inches; E,F (tall candleholders): H. 3 x DIam. 2-1/8 x 2-1/8 inches; G,H (medium candleholders): H. 2-7/8 x Diam. 2 inches; I, J (small candleholders): H. 1-1/2 x Diam. 2-1/4 inches; K, L (salt cellars): H. 1-5/8 x Diam. 2 x 2 inches; M (mug): H. 3-3/8 x W. 4-1/4 x D. 2-1/2 inches; N (plate): Diam. 5 x 5 inches; O (cup): H. 2-1/4 x W. 2-3/8 x D. 2-3/8 inches","Margo Grant Walsh Twentieth Century Silver and Metalwork Collection, gift of Margo Grant Walsh",N,https://jsmacollection.uoregon.edu/mwebcgi/mweb?request=record;id=136131;type=101,N1266
187,jsma2019_11_79.jpg,Caddy spoon,"Devlin, Stuart",1983,"""Prince of Wales"" caddy spoon with feather motif handle made in honor of the 25th anniversary of the investiture of the Prince of Wales.","Devlin, Stuart;British;Sterling silver, silver gilt, enamel;London, England","London, England",51.512348,-0.131508,JSMA2019:11.79,Image;StillImage,image/jpeg,British,"Sterling silver, silver gilt, enamel",2-1/2 inches,"Margo Grant Walsh Twentieth Century Silver and Metalwork Collection, gift of Margo Grant Walsh",Y,https://jsmacollection.uoregon.edu/mwebcgi/mweb?request=record;id=136133;type=101,N1289
191,jsma2016_12_56.jpg,Serving fork and spoon,"Adler, Allan",ca. 1969,"The name of the pattern of this serving set, Swedish Modern, refers to the fascination that American consumers had with Scandinavian design beginning in the post-World War II period. American silversmiths capitalized on the popularity of the modern, sleek styles produced by their Scandinavian counterparts. California-based silversmith Allan Adler became extremely well known for his Scandinavian-influenced style, gaining commissions for President John F. Kennedy, Winston Churchill, Katharine Hepburn and many other celebrities, as well as the crowns for Miss America and Miss Universe. Originally, Adler had no intention of entering the silver business. It wasn’t until he married Helen Rebecca Blanchard, daughter of the famous Arts and Crafts silversmith Porter Blanchard, that he became the apprentice to his father-in-law. When Adler opened his own shop in 1939, he broke away from the Arts and Crafts tradition, referring to his style as “clean lines with a bend towards the unconventional.” Adler remained a silversmith to the stars until his death in 2002, although his company, Allan Adler Designs Inc., remains in business today.","Adler, Allan;American;Sterling silver;Los Angeles, California","Los Angeles, California",,,"JSMA2016:12.56a,b",Image;StillImage,image/jpeg,American,Sterling silver,9-3/4 inches,"Margo Grant Walsh Twentieth Century Silver and Metalwork Collection, gift of Margo Grant Walsh",Y,https://jsmacollection.uoregon.edu/mwebcgi/mweb?request=record;id=119715;type=101,N0815
113,jsma2019_11_41.jpg,Spoon,"Adler, Allan",mid-20th century,,"Adler, Allan;American;Sterling silver;Los Angeles, California","Los Angeles, California",,,JSMA2019:11.41,Image;StillImage,image/jpeg,American,Sterling silver,5-1/4 inches,"Margo Grant Walsh Twentieth Century Silver and Metalwork Collection, gift of Margo Grant Walsh",Y,https://jsmacollection.uoregon.edu/mwebcgi/mweb?request=record;id=136092;type=101,N0677
185,jsma2019_11_72.jpg,Sugar tongs,"Adler, Allan",mid-20th century,,"Adler, Allan;American;Sterling silver;Los Angeles, California","Los Angeles, California",,,JSMA2019:11.72,Image;StillImage,image/jpeg,American,Sterling silver,4-1/2 inches,"Margo Grant Walsh Twentieth Century Silver and Metalwork Collection, gift of Margo Grant Walsh",Y,https://jsmacollection.uoregon.edu/mwebcgi/mweb?request=record;id=136126;type=101,N1189
114,jsma2019_11_73.jpg,Ladle,"Adler, Allan",mid-20th century,,"Adler, Allan;American;Sterling silver;Los Angeles, California","Los Angeles, California",,,JSMA2019:11.73,Image;StillImage,image/jpeg,American,Sterling silver,5 inches,"Margo Grant Walsh Twentieth Century Silver and Metalwork Collection, gift of Margo Grant Walsh",Y,https://jsmacollection.uoregon.edu/mwebcgi/mweb?request=record;id=136127;type=101,N1190
353,jsma2019_11_75.jpg,Serving set (3 pieces),"Adler, Allan",mid-20th century,,"Adler, Allan;American;Sterling silver;Los Angeles, California","Los Angeles, California",,,JSMA2019:11.75a-c,Image;StillImage,image/jpeg,American,Sterling silver,"Fork: 7-7/8 inches, spoon 7-3/4 inches, flat server: 7-5/8 inches","Margo Grant Walsh Twentieth Century Silver and Metalwork Collection, gift of Margo Grant Walsh",N,https://jsmacollection.uoregon.edu/mwebcgi/mweb?request=record;id=136129;type=101,N1194
116,jsma2016_12_40.jpg,Pin,Martin Mayer,early 20th century,"Small pin, possibly hat pin, decorated with pearls.","Martin Mayer;German;.935 fine silver, freshwater pearls;Mainz, Germany","Mainz, Germany",,,JSMA2016:12.40,Image;StillImage,image/jpeg,German,".935 fine silver, freshwater pearls",3-1/8 inches,"Margo Grant Walsh Twentieth Century Silver and Metalwork Collection, gift of Margo Grant Walsh",Y,https://jsmacollection.uoregon.edu/mwebcgi/mweb?request=record;id=119695;type=101,N0518
111,jsma2017_2_68.jpg,Spoon,"Morgan, James P.; Frank W. Smith Silver Co.",1945,,"Morgan, James P.; Frank W. Smith Silver Co.;American;Sterling silver;Massachusetts",Massachusetts,,,JSMA2017:2.68,Image;StillImage,image/jpeg,American,Sterling silver,8 inches,"Margo Grant Walsh Twentieth Century Silver and Metalwork Collection, gift of Margo Grant Walsh",Y,https://jsmacollection.uoregon.edu/mwebcgi/mweb?request=record;id=126268;type=101,N0224
383,jsma2019_11_108.jpg,Bowl,Gebelein Silversmiths,1910,,Gebelein Silversmiths;American;Sterling silver;Massachusetts,Massachusetts,,,JSMA2019:11.108,Image;StillImage,image/jpeg,American,Sterling silver,H. 2-1/8 x Diam. 5-1/2 inches,"Margo Grant Walsh Twentieth Century Silver and Metalwork Collection, gift of Margo Grant Walsh",N,https://jsmacollection.uoregon.edu/mwebcgi/mweb?request=record;id=136166;type=101,P0067
252,jsma2019_11_95.jpg,Flatware (5 pieces),"Bowlen, Nord; Lunt Silversmiths",20th century,,"Bowlen, Nord; Lunt Silversmiths;American;Silver and nylon (Zytel);Massachusetts",Massachusetts,,,JSMA2019:11.95a-e,Image;StillImage,image/jpeg,American,Silver and nylon (Zytel),A (serving fork): 9-1/2 inches; B (fork): 7-1/2 inches; C (carving knife): 9-1/2 inches; D (knife): 6-3/8 inches; E (spoon): 6-1/2 inches,"Margo Grant Walsh Twentieth Century Silver and Metalwork Collection, gift of Margo Grant Walsh",N,https://jsmacollection.uoregon.edu/mwebcgi/mweb?request=record;id=136150;type=101,N1618
441,jsma2016_12_118.jpg,Box,Bradley & Hubbard,ca. 1920,,"Bradley & Hubbard;American;Enameled copper;Meriden, Connecticut","Meriden, Connecticut",,,JSMA2016:12.118,Image;StillImage,image/jpeg,American,Enameled copper,H. 2-3/4 x W. 3-1/2 x D. 3-1/2 inches,"Margo Grant Walsh Twentieth Century Silver and Metalwork Collection, gift of Margo Grant Walsh",Y,https://jsmacollection.uoregon.edu/mwebcgi/mweb?request=record;id=122398;type=101,T051/S152
332,jsma2017_2_35.jpg,Salt cellar,"La Paglia, Alphonse",ca. 20th century,,"La Paglia, Alphonse;American;Silver;Meriden, Connecticut","Meriden, Connecticut",,,JSMA2017:2.35,Image;StillImage,image/jpeg,American,Silver,H. 2 x Diam. 2 inches,"Margo Grant Walsh Twentieth Century Silver and Metalwork Collection, gift of Margo Grant Walsh",Y,https://jsmacollection.uoregon.edu/mwebcgi/mweb?request=record;id=126365;type=101,NO MGW NUMBER
296,jsma2017_2_5.jpg,Inkwell,Bradley and Hubbard Manufacturing Company,ca. 1920-1940,"Based in Meriden, Connecticut, the Bradley and Hubbard Manufacturing Company produced an impressive range of high quality metalwork starting in the mid-19th century and continuing through the 20th century. Although Bradley and Hubbard deviated from purist Arts and Crafts principles with its use of mechanized production techniques, this inkwell reflects the honesty and simplicity of the Arts and Crafts aesthetic. Rather than disguising the purpose of the inkwell with unnecessary embellishments, the designer integrates the decorative pattern into the metal surface.","Bradley and Hubbard Manufacturing Company;American;Brass;Meriden, Connecticut","Meriden, Connecticut",,,JSMA2017:2.5,Image;StillImage,image/jpeg,American,Brass,H. 4-1/4 x W. 6-1/4 x D. 2-1/4 inches,"Margo Grant Walsh Twentieth Century Silver and Metalwork Collection, gift of Margo Grant Walsh",Y,https://jsmacollection.uoregon.edu/mwebcgi/mweb?request=record;id=126343;type=101,NO MGW NUMBER
523,jsma2017_2_58.jpg,Teapot,Meriden Silver Plate Company,19th century,,"Meriden Silver Plate Company;American;Electroplated Brittania silver;Meriden, Connecticut","Meriden, Connecticut",,,JSMA2017:2.58,Image;StillImage,image/jpeg,American,Electroplated Brittania silver,H. 6 x W. 10 x D. 4-3/4 inches,"Margo Grant Walsh Twentieth Century Silver and Metalwork Collection, gift of Margo Grant Walsh",Y,https://jsmacollection.uoregon.edu/mwebcgi/mweb?request=record;id=126328;type=101,N1280
524,jsma2017_2_59a.jpg,Creamer,Meriden Silver Plate Company,ca. 1898,,"Meriden Silver Plate Company;American;Electroplated Brittania silver;Meriden, Connecticut","Meriden, Connecticut",,,JSMA2017:2.59a,Image;StillImage,image/jpeg,American,Electroplated Brittania silver,H. 5 x W. 3-3/4 x D. 2-1/2 inches,"Margo Grant Walsh Twentieth Century Silver and Metalwork Collection, gift of Margo Grant Walsh",Y,https://jsmacollection.uoregon.edu/mwebcgi/mweb?request=record;id=126362;type=101,N1280
525,jsma2017_2_59a.jpg,Creamer,Meriden Silver Plate Company,ca. 1898,,"Meriden Silver Plate Company;American;Electroplated Brittania silver;Meriden, Connecticut","Meriden, Connecticut",,,JSMA2017:2.59a,Image;StillImage,image/jpeg,American,Electroplated Brittania silver,H. 5 x W. 3-3/4 x D. 2-1/2 inches,"Margo Grant Walsh Twentieth Century Silver and Metalwork Collection, gift of Margo Grant Walsh",Y,https://jsmacollection.uoregon.edu/mwebcgi/mweb?request=record;id=126362;type=101,NO MGW NUMBER
526,jsma2017_2_59b.jpg,Sugar bowl,Meriden Silver Plate Company,19th century,,"Meriden Silver Plate Company;American;Electroplated Brittania silver;Meriden, Connecticut","Meriden, Connecticut",,,JSMA2017:2.59b,Image;StillImage,image/jpeg,American,Electroplated Brittania silver,H. 6-1/2 x W. 4-3/4 x D. 3-3/8 inches,"Margo Grant Walsh Twentieth Century Silver and Metalwork Collection, gift of Margo Grant Walsh",Y,https://jsmacollection.uoregon.edu/mwebcgi/mweb?request=record;id=126335;type=101,NO MGW NUMBER
527,jsma2017_2_59b.jpg,Sugar bowl,Meriden Silver Plate Company,19th century,,"Meriden Silver Plate Company;American;Electroplated Brittania silver;Meriden, Connecticut","Meriden, Connecticut",,,JSMA2017:2.59b,Image;StillImage,image/jpeg,American,Electroplated Brittania silver,H. 6-1/2 x W. 4-3/4 x D. 3-3/8 inches,"Margo Grant Walsh Twentieth Century Silver and Metalwork Collection, gift of Margo Grant Walsh",Y,https://jsmacollection.uoregon.edu/mwebcgi/mweb?request=record;id=126335;type=101,N1280
365,jsma2019_11_2.jpg,Rectangular covered dish,International Silver Company,ca. 1931,,"International Silver Company;American;Sterling silver, wood;Meriden, Connecticut","Meriden, Connecticut",,,JSMA2019:11.2,Image;StillImage,image/jpeg,American,"Sterling silver, wood",H. 4 x W. 7 x D. 4-3/4 inches,"Margo Grant Walsh Twentieth Century Silver and Metalwork Collection, gift of Margo Grant Walsh",N,https://jsmacollection.uoregon.edu/mwebcgi/mweb?request=record;id=136048;type=101,N0041
