objectid,filename,title,creator,date,description,subject,location,latitude,longitude,identifier,type,format,culture,materials,measurements,credit,published,web_page,altnum
480,jsma2014_38_5.jpg,Tea service,Unknown,ca. 1910,"Brass tea service including teapot, creamer, sugar pot, stand, and burner. Possibly Austrian or German. Handmade bodies with factorymade spouts and handles.More affordable than silver, copper and brass were favorite materials of Arts and Crafts designers. This early 20th century brass tea service, possibly from Austria or Germany, features a handmade body with factory-made spouts and handles. Utilizing both handmade and machine-made parts was often a necessary compromise for manufacturers to remain commercially competitive.","Unknown;Undetermined;brass, wood, tinned interior;Possibly Austria or Germany",Possibly Austria or Germany,,,JSMA2014:38.5a-e,Image;StillImage,image/jpeg,Undetermined,"brass, wood, tinned interior",a: H. 8-1/2 x W. 11-1/2 x D. 6-1/2 inches; b: H. 5-1/4 x W. 7 x D. 4 inches; c: H. 5-3/4 x W. 4-1/4 x D. 4-1/4 inches,"Margo Grant Walsh Twentieth Century Silver and Metalwork Collection, gift of Margo Grant Walsh",Y,https://jsmacollection.uoregon.edu/mwebcgi/mweb?request=record;id=27160;type=101,T0037
49,jsma2016_12_33.jpg,Moth pin,Unknown,ca. 1910,"Botany, insects, and snakes were common motifs of Art Nouveau jewelry. In addition to natural motifs, Art Nouveau artists frequently employed enameling to provide lustrous color to their work. This moth pin was created using the cloisonné technique of fusing colored, ground glass to the metal base.","Unknown;;silver, enamel;Possibly England",Possibly England,,,JSMA2016:12.33,Image;StillImage,image/jpeg,,"silver, enamel",3-1/2 x 2-1/4 inches,"Margo Grant Walsh Twentieth Century Silver and Metalwork Collection, gift of Margo Grant Walsh",Y,https://jsmacollection.uoregon.edu/mwebcgi/mweb?request=record;id=119686;type=101,N0314
460,jsma2016_12_150.jpg,Glove box,Unknown,ca. 1900,"Art Nouveau silver-plated glove box with flowers and dragonfly, lined with velvet.","Unknown;;silverplate, velvet;Possibly France",Possibly France,,,JSMA2016:12.150,Image;StillImage,image/jpeg,,"silverplate, velvet",2-1/2 x 13-1/2 x 5 inches,"Margo Grant Walsh Twentieth Century Silver and Metalwork Collection, gift of Margo Grant Walsh",Y,https://jsmacollection.uoregon.edu/mwebcgi/mweb?request=record;id=122438;type=101,N0452
158,jsma2016_12_158.jpg,Necklace,Unknown,ca. 1930,Art Deco silver and brown enamel necklace.,"Unknown;;silver, enamel;Possibly Germany",Possibly Germany,,,JSMA2016:12.158,Image;StillImage,image/jpeg,,"silver, enamel",18 inches,"Margo Grant Walsh Twentieth Century Silver and Metalwork Collection, gift of Margo Grant Walsh",Y,https://jsmacollection.uoregon.edu/mwebcgi/mweb?request=record;id=122447;type=101,N0309
154,jsma2019_11_133.jpg,Pendant,Unknown,early 21st century,,"Unknown;Italian;18 karat yellow gold and white gold, diamonds, black malachite;Possibly Italy",Possibly Italy,,,JSMA2019:11.133,Image;StillImage,image/jpeg,Italian,"18 karat yellow gold and white gold, diamonds, black malachite",Pendant: 2-3/8 x 1-1/4 inches; chain: 15 inches,"Margo Grant Walsh Twentieth Century Silver and Metalwork Collection, gift of Margo Grant Walsh",Y,https://jsmacollection.uoregon.edu/mwebcgi/mweb?request=record;id=137899;type=101,N0957
486,jsma2019_11_62.jpg,Round tray,Unknown,ca. 1940s,"Potentially Mexican, Art Deco serving tray with two handles and reeded border, influence of Jensen, Spratling and Puiforcat",Unknown;Undetermined;silver;Possibly Mexico,Possibly Mexico,,,JSMA2019:11.62,Image;StillImage,image/jpeg,Undetermined,silver,1 x 9-1/2 x 8 inches,"Margo Grant Walsh Twentieth Century Silver and Metalwork Collection, gift of Margo Grant Walsh",N,https://jsmacollection.uoregon.edu/mwebcgi/mweb?request=record;id=136115;type=101,N1033
170,jsma2017_2_43.jpg,Caddy Spoon,Unknown,20th century,,"Unknown;Undetermined;silver, turqoise cabochon;Possibly Near East",Possibly Near East,,,JSMA2017:2.43,Image;StillImage,image/jpeg,Undetermined,"silver, turqoise cabochon",4-1/4 inches,"Margo Grant Walsh Twentieth Century Silver and Metalwork Collection, gift of Margo Grant Walsh",Y,https://jsmacollection.uoregon.edu/mwebcgi/mweb?request=record;id=126325;type=101,T0093
62,jsma2016_12_159.jpg,Necklace,Unknown,late 20th century,,"Unknown;;silver, lucite;Possibly Scandinavia",Possibly Scandinavia,,,JSMA2016:12.159,Image;StillImage,image/jpeg,,"silver, lucite","Chain: 29 inches, pendant: 3 x -5/8 inches","Margo Grant Walsh Twentieth Century Silver and Metalwork Collection, gift of Margo Grant Walsh",Y,https://jsmacollection.uoregon.edu/mwebcgi/mweb?request=record;id=122448;type=101,N0335
258,jsma2014_38_36.jpg,Bookends,Unknown,ca. 1920,,Unknown;Undetermined;bronze;Possibly UK,Possibly UK,,,"JSMA2014:38.36a,b",Image;StillImage,image/jpeg,Undetermined,bronze,each: H. 4-3/4 x W. 5-1/2 x D. 2-1/2 inches,"Margo Grant Walsh Twentieth Century Silver and Metalwork Collection, gift of Margo Grant Walsh",Y,https://jsmacollection.uoregon.edu/mwebcgi/mweb?request=record;id=27191;type=101,P0149
419,jsma2014_38_55.jpg,Box,Unknown,ca. 1910,Rectangular box with riveted strapwork and bracketed feet. Side panels chased with decorative scroll work and arrow motif. Decorative chasing and cartouche on lid. Hammered finish.,Unknown;Undetermined;Copper with wood liner;Possibly UK,Possibly UK,,,JSMA2014:38.55,Image;StillImage,image/jpeg,Undetermined,Copper with wood liner,H. 7 x W. 11-1/8 x D. 6- 5/8 inches,"Margo Grant Walsh Twentieth Century Silver and Metalwork Collection, gift of Margo Grant Walsh",Y,https://jsmacollection.uoregon.edu/mwebcgi/mweb?request=record;id=27210;type=101,P0145
452,jsma2014_38_60.jpg,Box,Unknown,ca. 1910-1920,,"Unknown;Undetermined;Silverplate, copper;Possibly UK",Possibly UK,,,JSMA2014:38.60,Image;StillImage,image/jpeg,Undetermined,"Silverplate, copper",H. 5-1/8 x W. 10 x D. 4-1/8 inches,"Margo Grant Walsh Twentieth Century Silver and Metalwork Collection, gift of Margo Grant Walsh",Y,https://jsmacollection.uoregon.edu/mwebcgi/mweb?request=record;id=27215;type=101,P0147
268,jsma2016_12_97.jpg,Bookends,Unknown,1910,Pierced bird motif.,Unknown;Undetermined;copper;Possibly UK,Possibly UK,,,JSMA2016:12.97a-b,Image;StillImage,image/jpeg,Undetermined,copper,5-7/8 x 5 inches,"Margo Grant Walsh Twentieth Century Silver and Metalwork Collection, gift of Margo Grant Walsh",Y,https://jsmacollection.uoregon.edu/mwebcgi/mweb?request=record;id=119761;type=101,T0091
117,jsma2016_12_45.jpg,Bracelet,Unknown,ca. 1915,"Cable link construction with toggle clasp, bezel set with 21 moonstones.","Unknown;Undetermined;silver, moonstone;Possibly United States",Possibly United States,,,JSMA2016:12.45,Image;StillImage,image/jpeg,Undetermined,"silver, moonstone",6-3/4 x 7/8 inches,"Margo Grant Walsh Twentieth Century Silver and Metalwork Collection, gift of Margo Grant Walsh",Y,https://jsmacollection.uoregon.edu/mwebcgi/mweb?request=record;id=119701;type=101,N0665
118,jsma2016_12_68.jpg,Necklace,Unknown,ca. 1910,"The pendant with one oval moonstone cabochon and two moonstone drops, also bezel-set with an oval faceted peridot and a round faceted tourmaline, on a replacement gold chain.","Unknown;Undetermined;gold, moonstone, peridon, tourmaline;Possibly United States",Possibly United States,,,JSMA2016:12.68,Image;StillImage,image/jpeg,Undetermined,"gold, moonstone, peridon, tourmaline","Chain: 12 inches, pendant: 2-1/8 inches","Margo Grant Walsh Twentieth Century Silver and Metalwork Collection, gift of Margo Grant Walsh",Y,https://jsmacollection.uoregon.edu/mwebcgi/mweb?request=record;id=119732;type=101,N1325
436,jsma2016_12_5.jpg,Small pot,Gorham Manufacturing Co.,1882,"In taking part of the Aesthetic Movement’s impulse towards japonisme, Gorham designers looked to Japanese wood-block prints for inspiration during the 1870s and 1880s. The influence of Japanese art is apparent in the hand-hammered surface and applied bell-pepper plant motif of this copper and sterling silver pot. The soaring bird is reminiscent of Katsushika Hokusai’s avian prints.","Gorham Manufacturing Co.;American;Sterling silver and copper;Providence, Rhode Island","Providence, Rhode Island",,,JSMA2016:12.5,Image;StillImage,image/jpeg,American,Sterling silver and copper,H. 3-3/8 x Diam. 4-1/4 inches,"Margo Grant Walsh Twentieth Century Silver and Metalwork Collection, gift of Margo Grant Walsh",Y,https://jsmacollection.uoregon.edu/mwebcgi/mweb?request=record;id=119658;type=101,N0084
328,jsma2017_2_25.jpg,Kylix,Gorham Manufacturing Co.,1872,"Founded in 1831 by Jabez Gorham in Providence, Rhode Island, Gorham Manufacturing Co. became one of the largest and most influential silver firms in America. The restrained ornamentation and clean lines of this kylix produced in 1872 reflect an American interpretation of the Renaissance Revival style. Marks: Gorham used the lion-anchor-“G” stamp as the company’s identifying mark. The lion indicates silver, the anchor refers to Rhode Island, and the G stands for Gorham. The number 1075 is likely the pattern number, while the letter “E” designates that piece was made in the year 1872.","Gorham Manufacturing Co.;American;Sterling silver;Providence, Rhode Island","Providence, Rhode Island",,,JSMA2017:2.25,Image;StillImage,image/jpeg,American,Sterling silver,H. 3-3/8 x W. 2-5/8 x D. 1-7/8 inches,"Margo Grant Walsh Twentieth Century Silver and Metalwork Collection, gift of Margo Grant Walsh",Y,https://jsmacollection.uoregon.edu/mwebcgi/mweb?request=record;id=126349;type=101,NO MGW NUMBER
488,jsma2019_11_114.jpg,Round tray,Gorham Manufacturing Co.,1930,,"Gorham Manufacturing Co.;American;Sterling silver;Providence, Rhode Island","Providence, Rhode Island",,,JSMA2019:11.114,Image;StillImage,image/jpeg,American,Sterling silver,H. 1 x W. 13-3/4 x D. 11 inches,"Margo Grant Walsh Twentieth Century Silver and Metalwork Collection, gift of Margo Grant Walsh",N,https://jsmacollection.uoregon.edu/mwebcgi/mweb?request=record;id=136175;type=101,T0010/S0139
497,jsma2019_11_3.jpg,Cake stand,Gorham Manufacturing Co.,ca. 1940,Cake stand with chased berry and leaf motif.,"Gorham Manufacturing Co.;American;Sterling silver;Providence, Rhode Island","Providence, Rhode Island",,,JSMA2019:11.3,Image;StillImage,image/jpeg,American,Sterling silver,H. 2-5/16 x Diam. 12-1/8 inches,"Margo Grant Walsh Twentieth Century Silver and Metalwork Collection, gift of Margo Grant Walsh",N,https://jsmacollection.uoregon.edu/mwebcgi/mweb?request=record;id=136049;type=101,N0043
412,jsma2019_11_59.jpg,Pitcher,Gorham Manufacturing Co.,1922,,"Gorham Manufacturing Co.;American;Sterling silver;Providence, Rhode Island","Providence, Rhode Island",,,JSMA2019:11.59,Image;StillImage,image/jpeg,American,Sterling silver,H. 7-3/4 x W. 8-1/2 inches,"Margo Grant Walsh Twentieth Century Silver and Metalwork Collection, gift of Margo Grant Walsh",N,https://jsmacollection.uoregon.edu/mwebcgi/mweb?request=record;id=136112;type=101,N1011
248,jsma2019_11_76.jpg,Ice cream server and 12 spoons,Gorham Manufacturing Co.,1870,"A 13 peice ice cream spoon and server set in the ""Palm Beach"" pattern. Gorham likely designed the pattern for a 1900 commission by Greenleaf and Crosby (G&C), which was a Florida jeweler.","Gorham Manufacturing Co.;American;Sterling silver and silver gilt;Providence, Rhode Island","Providence, Rhode Island",,,JSMA2019:11.76a-m,Image;StillImage,image/jpeg,American,Sterling silver and silver gilt,small spoons: 5-3/4 inches,"Margo Grant Walsh Twentieth Century Silver and Metalwork Collection, gift of Margo Grant Walsh",Y,https://jsmacollection.uoregon.edu/mwebcgi/mweb?request=record;id=136130;type=101,N1216
173,jsma2017_2_46.jpg,Spoon,Manchester Silver Co.,ca. 1915,,Manchester Silver Co.;American;Silver;Rhode Island,Rhode Island,,,JSMA2017:2.46,Image;StillImage,image/jpeg,American,Silver,5-1/4 inches,"Margo Grant Walsh Twentieth Century Silver and Metalwork Collection, gift of Margo Grant Walsh",Y,https://jsmacollection.uoregon.edu/mwebcgi/mweb?request=record;id=126310;type=101,N1429
246,jsma2019_11_70.jpg,Fork,Unknown,ca. 1900,"3-pronged, cannon handle with ball termina with niello work, possibly Russian",Unknown;Russian;silver;Russia,Russia,,,JSMA2019:11.70,Image;StillImage,image/jpeg,Russian,silver,6-3/4 inches,"Margo Grant Walsh Twentieth Century Silver and Metalwork Collection, gift of Margo Grant Walsh",N,https://jsmacollection.uoregon.edu/mwebcgi/mweb?request=record;id=136124;type=101,N1155
37,jsma2019_11_110.jpg,Napkin clip,"Bellis, John O.; Shreve & Company",ca. 1915,,"Bellis, John O.; Shreve & Company;American;Sterling silver;San Francisco, CA","San Francisco, CA",,,JSMA2019:11.110,Image;StillImage,image/jpeg,American,Sterling silver,H. 1 x W. 1-1/2 inches,"Margo Grant Walsh Twentieth Century Silver and Metalwork Collection, gift of Margo Grant Walsh",Y,https://jsmacollection.uoregon.edu/mwebcgi/mweb?request=record;id=136168;type=101,P0096
391,jsma2019_11_21.jpg,Wine coaster,Shreve & Company,n.d.,,"Shreve & Company;American;Sterling silver;San Francisco, CA","San Francisco, CA",,,JSMA2019:11.21,Image;StillImage,image/jpeg,American,Sterling silver,H. 1 x Diam. 6 inches,"Margo Grant Walsh Twentieth Century Silver and Metalwork Collection, gift of Margo Grant Walsh",N,https://jsmacollection.uoregon.edu/mwebcgi/mweb?request=record;id=136068;type=101,N0304
579,jsma2019_11_32.jpg,Paper knife,"Rhoten, Ruth",late 20th-early 21st century,"Paper knife used to separate pages of a book when book presses unable to cut individual pages efficiently. Limited edition of 33, commissioned by Koichi Hara for his gallery ""Japonesque""","Rhoten, Ruth;American;Sterling silver;San Francisco, CA","San Francisco, CA",,,JSMA2019:11.32,Image;StillImage,image/jpeg,American,Sterling silver,W. 12 x D. 2-1/2 inches,"Margo Grant Walsh Twentieth Century Silver and Metalwork Collection, gift of Margo Grant Walsh",N,https://jsmacollection.uoregon.edu/mwebcgi/mweb?request=record;id=136080;type=101,N0525
314,jsma2014_38_10.jpg,Basket,"van Erp, Dirk",ca. 1913-15,"Copper basket with hammered finish and handle attached with visible rivets, handle decorated with two arrow cutouts.","van Erp, Dirk;American;Copper;San Francisco, California","San Francisco, California",,,JSMA2014:38.10,Image;StillImage,image/jpeg,American,Copper,overall: H. 7 1/2 x W. 10 1/2 in; H. 19.05 x W. 26.67 cm,"Margo Grant Walsh Twentieth Century Silver and Metalwork Collection, gift of Margo Grant Walsh",Y,https://jsmacollection.uoregon.edu/mwebcgi/mweb?request=record;id=27165;type=101,N0061
549,jsma2014_38_28.jpg,Serving dish,Dirk van Erp Studio,ca. 1929-77,"The Dirk van Erp Studio of San Francisco produced this serving dish to hold baking dishes for a more elegant presentation. William van Erp took over his father's business (Dirk van Erp studio) in 1929 and added the ""handwrought"" portion to the die. The ""open box"" die (the right wall of the die had broken off when D'Arcy Gaw's name was removed in 1911) was used from 1913.","Dirk van Erp Studio;American;Hammered copper, brown patina;San Francisco, California","San Francisco, California",,,JSMA2014:38.28,Image;StillImage,image/jpeg,American,"Hammered copper, brown patina",H. 2-1/2 x W. 17-7/8 x D. 9-7/8 inches,"Margo Grant Walsh Twentieth Century Silver and Metalwork Collection, gift of Margo Grant Walsh",Y,https://jsmacollection.uoregon.edu/mwebcgi/mweb?request=record;id=27183;type=101,P0130
402,jsma2014_39_17.jpg,Pitcher,Dirk van Erp Studio,ca. 1950-1977,,"Dirk van Erp Studio;American;Sterling silver;San Francisco, California","San Francisco, California",,,JSMA2014:39.17,Image;StillImage,image/jpeg,American,Sterling silver,H. 9-1/2 x W. 7-7/8 x D. 6-3/8 inches,"Margo Grant Walsh Twentieth Century Silver and Metalwork Collection, gift of Margo Grant Walsh",Y,https://jsmacollection.uoregon.edu/mwebcgi/mweb?request=record;id=111124;type=101,N0937
492,jsma2014_39_3.jpg,Pair of serving dishes,"van Erp, William",ca. 1950,"Two serving dishes with scroll decoration and ivory feet, one slightly larger than the other. Intended to contain glass casserole dishes and provide a more elegant presentation of entrees.","van Erp, William;American;Silverplate with ivory feet;San Francisco, California","San Francisco, California",,,"JSMA2014:39.3a,b",Image;StillImage,image/jpeg,American,Silverplate with ivory feet,A: 2-13/16 x 17-1/4 x 11-5/16 inches; B: 2-1/2 x 16-3/4 x 10-7/8 inches,"Margo Grant Walsh Twentieth Century Silver and Metalwork Collection, gift of Margo Grant Walsh",Y,https://jsmacollection.uoregon.edu/mwebcgi/mweb?request=record;id=111110;type=101,N0062
493,jsma2014_39_3.jpg,Pair of serving dishes,"van Erp, William",ca. 1950,"Two serving dishes with scroll decoration and ivory feet, one slightly larger than the other. Intended to contain glass casserole dishes and provide a more elegant presentation of entrees.","van Erp, William;American;Silverplate with ivory feet;San Francisco, California","San Francisco, California",,,"JSMA2014:39.3a,b",Image;StillImage,image/jpeg,American,Silverplate with ivory feet,A: 2-13/16 x 17-1/4 x 11-5/16 inches; B: 2-1/2 x 16-3/4 x 10-7/8 inches,"Margo Grant Walsh Twentieth Century Silver and Metalwork Collection, gift of Margo Grant Walsh",Y,https://jsmacollection.uoregon.edu/mwebcgi/mweb?request=record;id=111110;type=101,N0063
219,jsma2014_39_4.jpg,Teaspoon blank,"van Erp, William",ca. 1960,,"van Erp, William;American;Sterling silver;San Francisco, California","San Francisco, California",,,JSMA2014:39.4,Image;StillImage,image/jpeg,American,Sterling silver,5-1/4 inches,"Margo Grant Walsh Twentieth Century Silver and Metalwork Collection, gift of Margo Grant Walsh",Y,https://jsmacollection.uoregon.edu/mwebcgi/mweb?request=record;id=111111;type=101,N0092
220,jsma2014_39_5.jpg,Fork blank,Dirk van Erp Studio,ca. 1920,,"Dirk van Erp Studio;American;Sterling silver;San Francisco, California","San Francisco, California",,,JSMA2014:39.5,Image;StillImage,image/jpeg,American,Sterling silver,8 inches,"Margo Grant Walsh Twentieth Century Silver and Metalwork Collection, gift of Margo Grant Walsh",Y,https://jsmacollection.uoregon.edu/mwebcgi/mweb?request=record;id=111112;type=101,N0093
79,jsma2016_12_135.jpg,Brooch,Unknown,20th century,,"Unknown;American;.800 silver, 18 karat gold, coral;San Francisco, California","San Francisco, California",,,JSMA2016:12.135,Image;StillImage,image/jpeg,American,".800 silver, 18 karat gold, coral",Diam. 2-1/8 inches,"Margo Grant Walsh Twentieth Century Silver and Metalwork Collection, gift of Margo Grant Walsh",Y,https://jsmacollection.uoregon.edu/mwebcgi/mweb?request=record;id=122417;type=101,N0321
99,jsma2016_12_27.jpg,Serving fork and spoon,Shreve & Company,ca. 1909,"Sterling silver serving fork and spoon, Norman pattern, hammered finish on handles.","Shreve & Company;American;Sterling silver;San Francisco, California","San Francisco, California",,,"JSMA2016:12.27a,b",Image;StillImage,image/jpeg,American,Sterling silver,each: 8-3/4 inches,"Margo Grant Walsh Twentieth Century Silver and Metalwork Collection, gift of Margo Grant Walsh",Y,https://jsmacollection.uoregon.edu/mwebcgi/mweb?request=record;id=119680;type=101,N0219
101,jsma2016_12_64.jpg,Serving spoon,Shreve & Company,ca. 1915,"Silver serving spoon in ""Antique"" hammered pattern.","Shreve & Company;American;Sterling silver;San Francisco, California","San Francisco, California",,,JSMA2016:12.64,Image;StillImage,image/jpeg,American,Sterling silver,9 inches,"Margo Grant Walsh Twentieth Century Silver and Metalwork Collection, gift of Margo Grant Walsh",Y,https://jsmacollection.uoregon.edu/mwebcgi/mweb?request=record;id=119728;type=101,N1185
29,jsma2016_12_83.jpg,Cross Pendant,"Baca, Lawrence",ca. 1960,Cross pendant with chased detail.,"Baca, Lawrence;American;Sterling silver;Sante Fe, New Mexico","Sante Fe, New Mexico",,,JSMA2016:12.83,Image;StillImage,image/jpeg,American,Sterling silver,Chain: 28 inches; pendant: W. 2-1/8 x D. 2-1/8 inches,"Margo Grant Walsh Twentieth Century Silver and Metalwork Collection, gift of Margo Grant Walsh",Y,https://jsmacollection.uoregon.edu/mwebcgi/mweb?request=record;id=119747;type=101,N1575
438,jsma2016_12_106.jpg,Box,Unknown,early 20th century,"Copper with red, yellow, green, and blue enamel, riveted, lock, velvet lined box. Originally owned by aviator Pancho Barnes.",Unknown;Scottish;Copper with enamel inlay;Scotland,Scotland,,,JSMA2016:12.106,Image;StillImage,image/jpeg,Scottish,Copper with enamel inlay,H. 4-5/8 x W. 6-7/8 x D. 4-7/16 inches,"Margo Grant Walsh Twentieth Century Silver and Metalwork Collection, gift of Margo Grant Walsh",Y,https://jsmacollection.uoregon.edu/mwebcgi/mweb?request=record;id=119771;type=101,N0011
439,jsma2016_12_106.jpg,Box,Unknown,early 20th century,"Copper with red, yellow, green, and blue enamel, riveted, lock, velvet lined box. Originally owned by aviator Pancho Barnes.",Unknown;Scottish;Copper with enamel inlay;Scotland,Scotland,,,JSMA2016:12.106,Image;StillImage,image/jpeg,Scottish,Copper with enamel inlay,H. 4-5/8 x W. 6-7/8 x D. 4-7/16 inches,"Margo Grant Walsh Twentieth Century Silver and Metalwork Collection, gift of Margo Grant Walsh",Y,https://jsmacollection.uoregon.edu/mwebcgi/mweb?request=record;id=119771;type=101,NO NUMBER 9
90,jsma2016_12_54.jpg,Serving fork and spoon,Unknown,ca. 1900,Modern serving set with decorative terminals bezel-set with jade and carnelian cabochon.,Unknown;Scottish;Pewter with jade and carnelian;Scottland,Scottland,,,"JSMA2016:12.54a,b",Image;StillImage,image/jpeg,Scottish,Pewter with jade and carnelian,each: 10-1/4 inches,"Margo Grant Walsh Twentieth Century Silver and Metalwork Collection, gift of Margo Grant Walsh",Y,https://jsmacollection.uoregon.edu/mwebcgi/mweb?request=record;id=119713;type=101,N0796
254,jsma2014_38_12.jpg,Pen tray,"Berry, Albert",ca. 1920,"Rectangular pen tray with applied strapwork and decorative art nouveau design, mother-of-pearl cabochons bezel-set at either end of rim.","Berry, Albert;American;Copper with mother-of-pearl cabochons;Seattle, Washington","Seattle, Washington",,,JSMA2014:38.12,Image;StillImage,image/jpeg,American,Copper with mother-of-pearl cabochons,W. 10-1/2 x D. 4-3/16 inches,"Margo Grant Walsh Twentieth Century Silver and Metalwork Collection, gift of Margo Grant Walsh",Y,https://jsmacollection.uoregon.edu/mwebcgi/mweb?request=record;id=27167;type=101,T0017
454,jsma2014_39_14.jpg,Card case,James Dixon & Sons,1907,Sterling silver card case with hammered ground and applied strapwork ornamentation with medallion at clasp. Leather interior has multiple dividers and ivory writing surface.,"James Dixon & Sons;British;Sterling silver, leather, and ivory;Sheffield, England","Sheffield, England",,,JSMA2014:39.14,Image;StillImage,image/jpeg,British,"Sterling silver, leather, and ivory",W. 4 x D. 2-7/8 inches,"Margo Grant Walsh Twentieth Century Silver and Metalwork Collection, gift of Margo Grant Walsh",Y,https://jsmacollection.uoregon.edu/mwebcgi/mweb?request=record;id=111121;type=101,N0414
543,jsma2019_11_101.jpg,Presentation bowl and spoon,William Hutton & Sons,1905,"Footed bowl with tapering strap handles, hammered finish, and chased pattern of stylized clover leaves. Matching spoon with hammered finish and traditional round-end pattern. Original presentation box.","William Hutton & Sons;British;Sterling silver;Sheffield, England","Sheffield, England",,,"JSMA2019:11.101a,b",Image;StillImage,image/jpeg,British,Sterling silver,Bowl: H. 2-5/16 x W. 6-7/8 x D. 4-1/2 inches; spoon: 6 inches,"Margo Grant Walsh Twentieth Century Silver and Metalwork Collection, gift of Margo Grant Walsh",N,https://jsmacollection.uoregon.edu/mwebcgi/mweb?request=record;id=136156;type=101,N0363
181,jsma2019_11_18.jpg,Caddy spoon,"Tyssen, Keith",1971,,"Tyssen, Keith;British;Sterling silver;Sheffield, England","Sheffield, England",,,JSMA2019:11.18,Image;StillImage,image/jpeg,British,Sterling silver,2-1/4 inches,"Margo Grant Walsh Twentieth Century Silver and Metalwork Collection, gift of Margo Grant Walsh",Y,https://jsmacollection.uoregon.edu/mwebcgi/mweb?request=record;id=136064;type=101,N0244
392,jsma2019_11_24.jpg,Bowl,"Jones, Albert Edward; Mappin & Webb",1935,,"Jones, Albert Edward; Mappin & Webb;British;Sterling silver and ivory;Sheffield, England","Sheffield, England",,,JSMA2019:11.24,Image;StillImage,image/jpeg,British,Sterling silver and ivory,H. 2-1/4 x W. 12 x D. 10-1/8 inches,"Margo Grant Walsh Twentieth Century Silver and Metalwork Collection, gift of Margo Grant Walsh",N,https://jsmacollection.uoregon.edu/mwebcgi/mweb?request=record;id=136071;type=101,N0362
377,jsma2019_11_31.jpg,Bowl,James Dixon & Sons,1912,,"James Dixon & Sons;British;Sterling silver;Sheffield, England","Sheffield, England",,,JSMA2019:11.31,Image;StillImage,image/jpeg,British,Sterling silver,H. 2-5/8 x W. 5-1/2 x D. 5-1/8 inches,"Margo Grant Walsh Twentieth Century Silver and Metalwork Collection, gift of Margo Grant Walsh",N,https://jsmacollection.uoregon.edu/mwebcgi/mweb?request=record;id=136079;type=101,N0513
186,jsma2019_11_78.jpg,Caddy spoon,William Hutton & Sons,1925,,"William Hutton & Sons;British;Sterling silver;Sheffield, England","Sheffield, England",,,JSMA2019:11.78,Image;StillImage,image/jpeg,British,Sterling silver,2-7/8 inches,"Margo Grant Walsh Twentieth Century Silver and Metalwork Collection, gift of Margo Grant Walsh",Y,https://jsmacollection.uoregon.edu/mwebcgi/mweb?request=record;id=136132;type=101,N1287
82,jsma2019_11_125.jpg,Brooch,Unknown,ca. 1960,,Unknown;South African;Sterling silver with tiger's eye cabochon;South Africa,South Africa,,,JSMA2019:11.125,Image;StillImage,image/jpeg,South African,Sterling silver with tiger's eye cabochon,W. 2-1/2 x D. 1-1/2 inches,"Margo Grant Walsh Twentieth Century Silver and Metalwork Collection, gift of Margo Grant Walsh",Y,https://jsmacollection.uoregon.edu/mwebcgi/mweb?request=record;id=136218;type=101,N0769
